### ISSUE TITLE
No traffic generated at all from this app VSO.import intellij DevOps plugin

### ISSUE THREAD

**Issue by theav8or** [microsoft/azure-devops-intellij#411]
Using the https://plugins.jetbrains.com/plugin/7981-azure-devops on 
IntelliJ on Windows
An example of working set: Target IP: 10.232.*.*, gproxy.corp.{domain}.com is the proxy IP address.

13:34:58.5972469          0.0000000         1:34:58 PM 11/24/2020  3899            10.234.*.*    gproxy.corp.{domain}.com           TCP            TCP:Flags=......S., SrcPort=2282, DstPort=HTTP Alternate(8080), PayloadLen=0, Seq=4071654569, Ack=0, Win=64240 ( Negotiating scale factor 0x8 ) = 64240
13:34:58.6008231          0.0035762         1:34:58 PM 11/24/2020  3901            gproxy.corp.{domain}.com           10.234.*.*    TCP            TCP:Flags=...A..S., SrcPort=HTTP Alternate(8080), DstPort=2282, PayloadLen=0, Seq=1996443681, Ack=4071654570, Win=29200 ( Negotiated scale factor 0x7 ) = 3737600
13:34:58.6010449          0.0002218         1:34:58 PM 11/24/2020  3902            10.234.*.*    gproxy.corp.{domain}.com           TCP            TCP:Flags=...A...., SrcPort=2282, DstPort=HTTP Alternate(8080), PayloadLen=0, Seq=4071654570, Ack=1996443682, Win=513 (scale factor 0x8) = 131328

13:34:58.6014310          0.0003861         1:34:58 PM 11/24/2020  3903            10.234.*.*   gproxy.corp.{domain}.com           HTTP            HTTP:Request, CONNECT app.vssps.visualstudio.com:443
13:34:58.6039871          0.0025561         1:34:58 PM 11/24/2020  3905            gproxy.corp.{domain}.com           10.234.*.*   TCP            TCP:Flags=...A...., SrcPort=HTTP Alternate(8080), DstPort=2282, PayloadLen=0, Seq=1996443682, Ack=4071654772, Win=237 (scale factor 0x7) = 30336
13:34:58.7129672          0.1089801         1:34:58 PM 11/24/2020  3925            gproxy.corp.{domain}.com           10.234.*.*   HTTP            HTTP:Response, HTTP/1.1, Status: Ok, URL: app.vssps.visualstudio.com:443

 **On non-working machine: there is no traffic generated at all from this app.**
